{
  "$schema": "https://json-schema.org/draft/2020-12/schema",
  "$id": "https://panic-at-the-syslog/contracts/events/findings.realtime.v1.schema.json",
  "title": "findings.realtime.v1",
  "type": "object",
  "required": [
    "schema_version",
    "finding_id",
    "correlation_id",
    "detected_at",
    "category",
    "confidence"
  ],
  "properties": {
    "schema_version": {"type": "string", "const": "1.0"},
    "finding_id": {"type": "string", "minLength": 1},
    "correlation_id": {"type": "string", "minLength": 1},
    "detected_at": {"type": "string", "format": "date-time"},
    "category": {"type": "string", "minLength": 1},
    "confidence": {"type": "number", "minimum": 0, "maximum": 1},
    "severity": {
      "type": "string",
      "enum": ["low", "medium", "high", "critical"]
    },
    "evidence": {
      "type": "array",
      "items": {
        "type": "object",
        "required": ["event_id", "source_device", "summary"],
        "properties": {
          "event_id": {"type": "string", "minLength": 1},
          "source_device": {"type": "string", "minLength": 1},
          "summary": {"type": "string", "minLength": 1}
        },
        "additionalProperties": false
      }
    },
    "details": {"type": "object", "additionalProperties": true}
  },
  "additionalProperties": false
}