{
  "schema_version": "1.0",
  "finding_id": "find-fw-001",
  "correlation_id": "corr-fw-001",
  "detected_at": "2026-01-15T10:10:00Z",
  "category": "firewall-deny-flood",
  "confidence": 0.70,
  "severity": "medium",
  "evidence": [
    {
      "event_id": "evt-301",
      "source_device": "firewall-a",
      "summary": "Denied TCP 192.0.2.50:44321 -> 10.0.0.1:22"
    }
  ],
  "details": {
    "source_ip": "192.0.2.50",
    "deny_count": 25
  }
}
