{
  "schema_version": "1.0",
  "finding_id": "find-001",
  "correlation_id": "corr-001",
  "detected_at": "2026-01-15T10:00:10Z",
  "category": "brute-force-suspected",
  "confidence": 0.82,
  "severity": "high",
  "evidence": [
    {
      "event_id": "evt-101",
      "source_device": "router-a",
      "summary": "Failed password for admin from 192.0.2.10"
    }
  ],
  "details": {
    "source_ip": "192.0.2.10",
    "attempts": 14
  }
}